### ISSUE TITLE
Fluent-Bit Buffer Warning

### ISSUE THREAD

**Issue by sammerry** [komamitsu/fluency#96]
I'm running into a constant exception as if fluency isn't respecting setBufferChunkRetentionSize. It starts out working fine but as i up the request volume it ramps up the exceptions.

Exception triggered in fluency when writing to fluent bit.
```
java.io.IOException: Connection reset by peer
```

in fluent bit
```
[2018/04/18 23:13:41] [ warn] [in_fw] fd=18 incoming data exceed limit (32768 bytes)
```
fluency settings
```
    .setFlushIntervalMillis(100)
    .setBufferChunkRetentionSize(1*1024 * 1024)
    .setBufferChunkInitialSize(2*1024 * 1024)
    .setMaxBufferSize(32*1024*1024)
```

**Comment by komamitsu** [comment]
When I configured Fluency with `setBufferChunkRetentionSize(8 * 1024)`, about 8KB chunks were sent expectedly.
```
    new Fluency.Config()
            .setBufferChunkInitialSize(2 * 1024)
            .setBufferChunkRetentionSize(8 * 1024)
```

```
$ sudo tcpdump -i lo0 -vvv tcp port 24224
    :
22:40:57.796325 IP (tos 0x0, ttl 64, id 59249, offset 0, flags [DF], proto TCP (6), length 8286, bad cksum 0 (->3526)!)
    localhost.61696 > localhost.24224: Flags [P.], cksum 0x1e53 (incorrect -> 0x55f3), seq 1:8235, ack 1, win 12759, options [nop,nop,TS val 750625017 ecr 750624926], length 8234
22:40:57.796371 IP (tos 0x0, ttl 64, id 26475, offset 0, flags [DF], proto TCP (6), length 52, bad cksum 0 (->d556)!)
    localhost.24224 > localhost.61696: Flags [.], cksum 0xfe28 (incorrect -> 0xbe2e), seq 1, ack 8235, win 12502, options [nop,nop,TS val 750625017 ecr 750625017], length 0
22:40:57.796870 IP (tos 0x0, ttl 64, id 24984, offset 0, flags [DF], proto TCP (6), length 8286, bad cksum 0 (->baff)!)
    localhost.61696 > localhost.24224: Flags [P.], cksum 0x1e53 (incorrect -> 0x356e), seq 8235:16469, ack 1, win 12759, options [nop,nop,TS val 750625017 ecr 750625017], length 8234
22:40:57.796899 IP (tos 0x0, ttl 64, id 14232, offset 0, flags [DF], proto TCP (6), length 52, bad cksum 0 (->52a)!)
    localhost.24224 > localhost.61696: Flags [.], cksum 0xfe28 (incorrect -> 0x9f06), seq 1, ack 16469, win 12244, options [nop,nop,TS val 750625017 ecr 750625017], length 0
22:40:57.797010 IP (tos 0x0, ttl 64, id 11190, offset 0, flags [DF], proto TCP (6), length 8286, bad cksum 0 (->f0e1)!)
    localhost.61696 > localhost.24224: Flags [P.], cksum 0x1e53 (incorrect -> 0x1544), seq 16469:24703, ack 1, win 12759, options [nop,nop,TS val 750625017 ecr 750625017], length 8234
    :
```

How about setting less than 32KB not 1MB?

**Comment by sammerry** [comment]
set to 1024 and still got the error.

**Comment by komamitsu** [comment]
Hmm. If you can capture TCP packets like my comment above, it would be very helpful for investigation.

**Comment by sammerry** [comment]
i should be able to get to this this weekend.

**Comment by komamitsu** [comment]
I'm closing this issue. If you still have troubles, feel free to reopen it.
